{
  "$schema": "https://json-schema.org/draft/2020-12/schema",
  "$id": "https://droidkit.dev/schema/item.json",
  "title": "DroidKit registry item",
  "description": "Metadata for one installable item. Lives as registry.json beside the Kotlin files.",
  "type": "object",
  "additionalProperties": false,
  "required": ["name", "type", "description", "files", "platform", "themeVersion", "status", "states"],
  "properties": {
    "name": {
      "type": "string",
      "pattern": "^[a-z][a-z0-9-]*$",
      "description": "Kebab-case id used by the CLI: droidkit add <name>"
    },
    "type": {
      "type": "string",
      "enum": ["theme", "foundation", "component", "pattern", "block", "recipe"]
    },
    "description": {
      "type": "string",
      "description": "One sentence. When to use it."
    },
    "avoidWhen": {
      "type": "string",
      "description": "One sentence. When not to use it."
    },
    "status": {
      "type": "string",
      "enum": ["draft", "review", "ready"],
      "description": "draft: being built. review: gates green, awaiting fresh-eyes review and device pass. ready: publishable. See docs/verification.md"
    },
    "states": {
      "type": "array",
      "minItems": 1,
      "uniqueItems": true,
      "items": { "type": "string", "pattern": "^[a-z][a-z0-9-]*$" },
      "description": "Declared UX states. Each needs a @Preview named '<name> <state>' in the preview file; the lint enforces it and the screenshot test renders it. Theme items may declare a single 'default'."
    },
    "sources": {
      "type": "array",
      "items": { "type": "string", "pattern": "^kb://" },
      "default": [],
      "description": "Official docs consulted while building (android docs search/fetch kb:// URLs). Review checks trigger topics against these."
    },
    "files": {
      "type": "array",
      "minItems": 1,
      "items": {
        "type": "object",
        "additionalProperties": false,
        "required": ["path", "kind"],
        "properties": {
          "path": { "type": "string" },
          "kind": {
            "type": "string",
            "enum": ["source", "preview", "test"],
            "description": "source and preview copy by default; test copies with --with-tests"
          }
        }
      }
    },
    "dependencies": {
      "type": "array",
      "items": { "type": "string" },
      "default": [],
      "description": "Maven coordinates the CLI may add, e.g. io.coil-kt.coil3:coil-compose:3.0.0"
    },
    "registryDependencies": {
      "type": "array",
      "items": { "type": "string", "pattern": "^[a-z][a-z0-9-]*$" },
      "default": [],
      "description": "Other items that must be installed first"
    },
    "platform": {
      "type": "string",
      "enum": ["android", "common"],
      "description": "android uses Android-only APIs; common is Compose Multiplatform-compatible"
    },
    "minSdk": { "type": "integer", "minimum": 21, "default": 24 },
    "composeBom": {
      "type": "string",
      "description": "Minimum androidx.compose:compose-bom version this item compiles against"
    },
    "themeVersion": {
      "type": "integer",
      "minimum": 1,
      "description": "Theme contract version this item requires"
    },
    "experimentalApis": {
      "type": "array",
      "items": { "type": "string" },
      "default": [],
      "description": "Opt-in annotations the copied code carries, e.g. androidx.compose.material3.ExperimentalMaterial3Api"
    },
    "adaptive": {
      "type": "boolean",
      "default": false,
      "description": "Changes layout across window size classes"
    },
    "accessibility": {
      "type": "object",
      "additionalProperties": false,
      "properties": {
        "talkback": { "type": "boolean" },
        "dynamicType": { "type": "boolean" },
        "rtl": { "type": "boolean" },
        "keyboard": { "type": "boolean" },
        "touchTarget": { "type": "boolean" }
      }
    },
    "examples": {
      "type": "array",
      "items": {
        "type": "object",
        "additionalProperties": false,
        "required": ["title", "code"],
        "properties": {
          "title": { "type": "string" },
          "code": { "type": "string" }
        }
      },
      "default": []
    },
    "aiHints": {
      "type": "array",
      "items": { "type": "string" },
      "default": [],
      "description": "Short rules an agent should follow when composing this item"
    },
    "ux": {
      "type": "array",
      "default": [],
      "description": "The experience spec, written before the state matrix. One entry per user moment (see, reach, act, mistake, recover, succeed, leave). Review checks every entry against the code and the goldens; exactly one entry is the signature detail. See docs/verification.md",
      "items": {
        "type": "object",
        "additionalProperties": false,
        "required": ["moment", "behaviour", "why"],
        "properties": {
          "moment": {
            "type": "string",
            "enum": ["see", "reach", "act", "mistake", "recover", "succeed", "leave"],
            "description": "Which moment of the user's journey this row decides"
          },
          "behaviour": {
            "type": "string",
            "description": "What the item does, in one sentence a tester can check"
          },
          "why": {
            "type": "string",
            "description": "The user-facing reason. If it reads like a spec, it is not a why"
          },
          "signature": {
            "type": "boolean",
            "default": false,
            "description": "The one detail a user would notice and remember. At most one per item"
          },
          "reducedMotion": {
            "type": "string",
            "description": "Required when behaviour animates: what happens at animator scale 0 / reduced motion"
          }
        }
      }
    },
    "items": {
      "type": "array",
      "items": { "type": "string" },
      "description": "Recipe only: the items this recipe installs"
    }
  },
  "allOf": [
    {
      "if": { "properties": { "type": { "const": "recipe" } } },
      "then": { "required": ["items"] }
    }
  ]
}
