{
  "name": "empty-state",
  "type": "pattern",
  "description": "One title, one short description, and at most one primary action when a collection has no content.",
  "avoidWhen": "Do not use for loading or errors.",
  "status": "draft",
  "states": [
    "default",
    "with-icon",
    "no-action",
    "long-text",
    "rtl",
    "dark",
    "large-font"
  ],
  "files": [
    { "path": "EmptyState.kt", "kind": "source" },
    { "path": "EmptyStatePreview.kt", "kind": "preview" },
    { "path": "EmptyStateTest.kt", "kind": "test" }
  ],
  "dependencies": [],
  "registryDependencies": ["theme", "button"],
  "platform": "common",
  "minSdk": 24,
  "composeBom": "2026.03.01",
  "themeVersion": 1,
  "experimentalApis": [],
  "accessibility": {
    "talkback": true,
    "dynamicType": true,
    "rtl": true
  },
  "aiHints": [
    "Pass fillMaxSize (or other extra height) when this is the only content on the screen so the stack centers",
    "Do not add a second button or a text link next to the primary action"
  ],
  "sources": [
    "kb://android/develop/ui/compose/accessibility/merging-clearing",
    "kb://android/develop/ui/compose/accessibility/api-defaults"
  ]
}
