{
  "name": "settings",
  "type": "block",
  "description": "Settings list with 48 dp rows and list|detail on large width; state and callbacks in.",
  "avoidWhen": "Do not use for a single preference row, and do not add a ViewModel, NavHost, or DI graph to this file.",
  "status": "review",
  "ux": [
    {
      "moment": "act",
      "behaviour": "The whole 48 dp row toggles the switch, with a tick haptic; the Switch itself is display-only so TalkBack reads one control",
      "why": "You aim at the row you can read, not the thumb you cannot",
      "signature": true
    },
    {
      "moment": "reach",
      "behaviour": "Tapping Appearance opens the detail pane: the phone replaces the list, a tablet keeps list and detail side by side",
      "why": "The same file works on both without a fork the caller has to maintain"
    },
    {
      "moment": "leave",
      "behaviour": "Which pane is open survives rotation; setting values are the caller's and travel with their state",
      "why": "Turning the phone should not lose your place"
    }
  ],
  "states": [
    "default",
    "dark",
    "large-font",
    "rtl",
    "tablet"
  ],
  "sources": [
    "kb://android/develop/ui/compose/accessibility/api-defaults",
    "kb://android/develop/ui/compose/layouts/adaptive/list-detail",
    "kb://android/develop/ui/compose/lists",
    "kb://android/develop/ui/compose/side-effects"
  ],
  "files": [
    { "path": "SettingsScreen.kt", "kind": "source" },
    { "path": "SettingsScreenPreview.kt", "kind": "preview" },
    { "path": "SettingsScreenTest.kt", "kind": "test" }
  ],
  "dependencies": [
    "androidx.compose.material3.adaptive:adaptive",
    "androidx.compose.material3.adaptive:adaptive-layout",
    "androidx.compose.material3.adaptive:adaptive-navigation"
  ],
  "registryDependencies": ["theme", "foundation", "button"],
  "platform": "android",
  "minSdk": 24,
  "composeBom": "2026.03.01",
  "themeVersion": 1,
  "experimentalApis": [
    "androidx.compose.material3.ExperimentalMaterial3Api",
    "androidx.compose.material3.adaptive.ExperimentalMaterial3AdaptiveApi"
  ],
  "adaptive": true,
  "accessibility": {
    "talkback": true,
    "dynamicType": true,
    "rtl": true,
    "keyboard": true,
    "touchTarget": true
  },
  "aiHints": [
    "Remember callbacks before passing them into LazyColumn items",
    "Keep Switch onCheckedChange null and make the parent row toggleable",
    "Do not fork with if (isTablet); NavigableListDetailPaneScaffold adapts from window size",
    "Wire onThemeClick; the appearance row opens the detail pane"
  ]
}
